{
  "$id": "https://github.com/offware-apps/Postcards/blob/main/apps/postcards/src/lib/schema/portable-file.schema.json",
  "title": "Postcards portable data file (schemaVersion 12)",
  "$schema": "https://json-schema.org/draft/2020-12/schema",
  "type": "object",
  "properties": {
    "format": {
      "type": "string",
      "const": "postcards"
    },
    "schemaVersion": {
      "type": "integer",
      "minimum": 1,
      "maximum": 9007199254740991
    },
    "exportedAt": {
      "type": "string",
      "format": "date-time",
      "pattern": "^(?:(?:\\d\\d[2468][048]|\\d\\d[13579][26]|\\d\\d0[48]|[02468][048]00|[13579][26]00)-02-29|\\d{4}-(?:(?:0[13578]|1[02])-(?:0[1-9]|[12]\\d|3[01])|(?:0[469]|11)-(?:0[1-9]|[12]\\d|30)|(?:02)-(?:0[1-9]|1\\d|2[0-8])))T(?:(?:[01]\\d|2[0-3]):[0-5]\\d(?::[0-5]\\d(?:\\.\\d+)?)?(?:Z|([+-](?:[01]\\d|2[0-3]):[0-5]\\d)))$"
    },
    "visits": {
      "maxItems": 200000,
      "type": "array",
      "items": {
        "type": "object",
        "properties": {
          "visitId": {
            "type": "string",
            "minLength": 1,
            "maxLength": 100
          },
          "place": {
            "type": "object",
            "properties": {
              "kind": {
                "type": "string",
                "enum": [
                  "country",
                  "city",
                  "airport",
                  "heritage",
                  "custom"
                ]
              },
              "id": {
                "type": "string",
                "minLength": 1,
                "maxLength": 64
              },
              "name": {
                "type": "string",
                "minLength": 1,
                "maxLength": 200
              },
              "countryId": {
                "type": "string",
                "pattern": "^[A-Z]{2}$"
              },
              "lat": {
                "type": "number",
                "minimum": -90,
                "maximum": 90
              },
              "lon": {
                "type": "number",
                "minimum": -180,
                "maximum": 180
              },
              "population": {
                "type": "integer",
                "minimum": 0,
                "maximum": 100000000
              }
            },
            "required": [
              "kind",
              "id",
              "name",
              "countryId"
            ],
            "additionalProperties": false
          },
          "status": {
            "default": "visited",
            "type": "string",
            "enum": [
              "visited",
              "wishlist"
            ]
          },
          "favorite": {
            "default": false,
            "type": "boolean"
          },
          "date": {
            "anyOf": [
              {
                "type": "string",
                "pattern": "^\\d{4}-\\d{2}-\\d{2}$"
              },
              {
                "type": "null"
              }
            ]
          },
          "note": {
            "anyOf": [
              {
                "type": "string",
                "maxLength": 2000
              },
              {
                "type": "null"
              }
            ]
          },
          "photo": {
            "anyOf": [
              {
                "type": "string",
                "maxLength": 6000000
              },
              {
                "type": "null"
              }
            ]
          },
          "photos": {
            "maxItems": 48,
            "type": "array",
            "items": {
              "type": "object",
              "properties": {
                "src": {
                  "type": "string",
                  "maxLength": 6000000
                },
                "caption": {
                  "anyOf": [
                    {
                      "type": "string",
                      "maxLength": 300
                    },
                    {
                      "type": "null"
                    }
                  ]
                }
              },
              "required": [
                "src"
              ],
              "additionalProperties": false
            }
          },
          "folder": {
            "type": "string",
            "maxLength": 80
          },
          "addedAt": {
            "type": "string",
            "format": "date-time",
            "pattern": "^(?:(?:\\d\\d[2468][048]|\\d\\d[13579][26]|\\d\\d0[48]|[02468][048]00|[13579][26]00)-02-29|\\d{4}-(?:(?:0[13578]|1[02])-(?:0[1-9]|[12]\\d|3[01])|(?:0[469]|11)-(?:0[1-9]|[12]\\d|30)|(?:02)-(?:0[1-9]|1\\d|2[0-8])))T(?:(?:[01]\\d|2[0-3]):[0-5]\\d(?::[0-5]\\d(?:\\.\\d+)?)?(?:Z|([+-](?:[01]\\d|2[0-3]):[0-5]\\d)))$"
          },
          "updatedAt": {
            "type": "string",
            "format": "date-time",
            "pattern": "^(?:(?:\\d\\d[2468][048]|\\d\\d[13579][26]|\\d\\d0[48]|[02468][048]00|[13579][26]00)-02-29|\\d{4}-(?:(?:0[13578]|1[02])-(?:0[1-9]|[12]\\d|3[01])|(?:0[469]|11)-(?:0[1-9]|[12]\\d|30)|(?:02)-(?:0[1-9]|1\\d|2[0-8])))T(?:(?:[01]\\d|2[0-3]):[0-5]\\d(?::[0-5]\\d(?:\\.\\d+)?)?(?:Z|([+-](?:[01]\\d|2[0-3]):[0-5]\\d)))$"
          }
        },
        "required": [
          "visitId",
          "place",
          "addedAt"
        ],
        "additionalProperties": false
      }
    },
    "trips": {
      "maxItems": 200000,
      "type": "array",
      "items": {
        "type": "object",
        "properties": {
          "tripId": {
            "type": "string",
            "minLength": 1,
            "maxLength": 100
          },
          "name": {
            "type": "string",
            "maxLength": 80
          },
          "from": {
            "type": "object",
            "properties": {
              "kind": {
                "type": "string",
                "enum": [
                  "country",
                  "city",
                  "airport",
                  "heritage",
                  "custom"
                ]
              },
              "id": {
                "type": "string",
                "minLength": 1,
                "maxLength": 64
              },
              "name": {
                "type": "string",
                "minLength": 1,
                "maxLength": 200
              },
              "countryId": {
                "type": "string",
                "pattern": "^[A-Z]{2}$"
              },
              "lat": {
                "type": "number",
                "minimum": -90,
                "maximum": 90
              },
              "lon": {
                "type": "number",
                "minimum": -180,
                "maximum": 180
              },
              "population": {
                "type": "integer",
                "minimum": 0,
                "maximum": 100000000
              }
            },
            "required": [
              "kind",
              "id",
              "name",
              "countryId"
            ],
            "additionalProperties": false
          },
          "to": {
            "type": "object",
            "properties": {
              "kind": {
                "type": "string",
                "enum": [
                  "country",
                  "city",
                  "airport",
                  "heritage",
                  "custom"
                ]
              },
              "id": {
                "type": "string",
                "minLength": 1,
                "maxLength": 64
              },
              "name": {
                "type": "string",
                "minLength": 1,
                "maxLength": 200
              },
              "countryId": {
                "type": "string",
                "pattern": "^[A-Z]{2}$"
              },
              "lat": {
                "type": "number",
                "minimum": -90,
                "maximum": 90
              },
              "lon": {
                "type": "number",
                "minimum": -180,
                "maximum": 180
              },
              "population": {
                "type": "integer",
                "minimum": 0,
                "maximum": 100000000
              }
            },
            "required": [
              "kind",
              "id",
              "name",
              "countryId"
            ],
            "additionalProperties": false
          },
          "stops": {
            "minItems": 2,
            "maxItems": 200,
            "type": "array",
            "items": {
              "type": "object",
              "properties": {
                "kind": {
                  "type": "string",
                  "enum": [
                    "country",
                    "city",
                    "airport",
                    "heritage",
                    "custom"
                  ]
                },
                "id": {
                  "type": "string",
                  "minLength": 1,
                  "maxLength": 64
                },
                "name": {
                  "type": "string",
                  "minLength": 1,
                  "maxLength": 200
                },
                "countryId": {
                  "type": "string",
                  "pattern": "^[A-Z]{2}$"
                },
                "lat": {
                  "type": "number",
                  "minimum": -90,
                  "maximum": 90
                },
                "lon": {
                  "type": "number",
                  "minimum": -180,
                  "maximum": 180
                },
                "population": {
                  "type": "integer",
                  "minimum": 0,
                  "maximum": 100000000
                }
              },
              "required": [
                "kind",
                "id",
                "name",
                "countryId"
              ],
              "additionalProperties": false
            }
          },
          "mode": {
            "default": "flight",
            "type": "string",
            "enum": [
              "flight",
              "train",
              "bus",
              "ferry",
              "car",
              "other"
            ]
          },
          "legModes": {
            "maxItems": 200,
            "type": "array",
            "items": {
              "type": "string",
              "enum": [
                "flight",
                "train",
                "bus",
                "ferry",
                "car",
                "other"
              ]
            }
          },
          "date": {
            "anyOf": [
              {
                "type": "string",
                "pattern": "^\\d{4}(-\\d{2}(-\\d{2})?)?$"
              },
              {
                "type": "null"
              }
            ]
          },
          "carrier": {
            "anyOf": [
              {
                "type": "string",
                "maxLength": 120
              },
              {
                "type": "null"
              }
            ]
          },
          "note": {
            "anyOf": [
              {
                "type": "string",
                "maxLength": 2000
              },
              {
                "type": "null"
              }
            ]
          },
          "addedAt": {
            "type": "string",
            "format": "date-time",
            "pattern": "^(?:(?:\\d\\d[2468][048]|\\d\\d[13579][26]|\\d\\d0[48]|[02468][048]00|[13579][26]00)-02-29|\\d{4}-(?:(?:0[13578]|1[02])-(?:0[1-9]|[12]\\d|3[01])|(?:0[469]|11)-(?:0[1-9]|[12]\\d|30)|(?:02)-(?:0[1-9]|1\\d|2[0-8])))T(?:(?:[01]\\d|2[0-3]):[0-5]\\d(?::[0-5]\\d(?:\\.\\d+)?)?(?:Z|([+-](?:[01]\\d|2[0-3]):[0-5]\\d)))$"
          },
          "updatedAt": {
            "type": "string",
            "format": "date-time",
            "pattern": "^(?:(?:\\d\\d[2468][048]|\\d\\d[13579][26]|\\d\\d0[48]|[02468][048]00|[13579][26]00)-02-29|\\d{4}-(?:(?:0[13578]|1[02])-(?:0[1-9]|[12]\\d|3[01])|(?:0[469]|11)-(?:0[1-9]|[12]\\d|30)|(?:02)-(?:0[1-9]|1\\d|2[0-8])))T(?:(?:[01]\\d|2[0-3]):[0-5]\\d(?::[0-5]\\d(?:\\.\\d+)?)?(?:Z|([+-](?:[01]\\d|2[0-3]):[0-5]\\d)))$"
          }
        },
        "required": [
          "tripId",
          "from",
          "to",
          "addedAt"
        ],
        "additionalProperties": false
      }
    },
    "stories": {
      "maxItems": 200000,
      "type": "array",
      "items": {
        "type": "object",
        "properties": {
          "storyId": {
            "type": "string",
            "minLength": 1,
            "maxLength": 100
          },
          "place": {
            "type": "object",
            "properties": {
              "kind": {
                "type": "string",
                "enum": [
                  "country",
                  "city",
                  "airport",
                  "heritage",
                  "custom"
                ]
              },
              "id": {
                "type": "string",
                "minLength": 1,
                "maxLength": 64
              },
              "name": {
                "type": "string",
                "minLength": 1,
                "maxLength": 200
              },
              "countryId": {
                "type": "string",
                "pattern": "^[A-Z]{2}$"
              },
              "lat": {
                "type": "number",
                "minimum": -90,
                "maximum": 90
              },
              "lon": {
                "type": "number",
                "minimum": -180,
                "maximum": 180
              },
              "population": {
                "type": "integer",
                "minimum": 0,
                "maximum": 100000000
              }
            },
            "required": [
              "kind",
              "id",
              "name",
              "countryId"
            ],
            "additionalProperties": false
          },
          "date": {
            "type": "string",
            "pattern": "^\\d{4}-\\d{2}-\\d{2}$"
          },
          "title": {
            "type": "string",
            "maxLength": 200
          },
          "text": {
            "type": "string",
            "maxLength": 8000
          },
          "folder": {
            "type": "string",
            "maxLength": 80
          },
          "photos": {
            "maxItems": 24,
            "type": "array",
            "items": {
              "type": "object",
              "properties": {
                "src": {
                  "type": "string",
                  "maxLength": 6000000
                },
                "caption": {
                  "anyOf": [
                    {
                      "type": "string",
                      "maxLength": 300
                    },
                    {
                      "type": "null"
                    }
                  ]
                }
              },
              "required": [
                "src"
              ],
              "additionalProperties": false
            }
          },
          "addedAt": {
            "type": "string",
            "format": "date-time",
            "pattern": "^(?:(?:\\d\\d[2468][048]|\\d\\d[13579][26]|\\d\\d0[48]|[02468][048]00|[13579][26]00)-02-29|\\d{4}-(?:(?:0[13578]|1[02])-(?:0[1-9]|[12]\\d|3[01])|(?:0[469]|11)-(?:0[1-9]|[12]\\d|30)|(?:02)-(?:0[1-9]|1\\d|2[0-8])))T(?:(?:[01]\\d|2[0-3]):[0-5]\\d(?::[0-5]\\d(?:\\.\\d+)?)?(?:Z|([+-](?:[01]\\d|2[0-3]):[0-5]\\d)))$"
          },
          "updatedAt": {
            "type": "string",
            "format": "date-time",
            "pattern": "^(?:(?:\\d\\d[2468][048]|\\d\\d[13579][26]|\\d\\d0[48]|[02468][048]00|[13579][26]00)-02-29|\\d{4}-(?:(?:0[13578]|1[02])-(?:0[1-9]|[12]\\d|3[01])|(?:0[469]|11)-(?:0[1-9]|[12]\\d|30)|(?:02)-(?:0[1-9]|1\\d|2[0-8])))T(?:(?:[01]\\d|2[0-3]):[0-5]\\d(?::[0-5]\\d(?:\\.\\d+)?)?(?:Z|([+-](?:[01]\\d|2[0-3]):[0-5]\\d)))$"
          }
        },
        "required": [
          "storyId",
          "place",
          "date",
          "addedAt"
        ],
        "additionalProperties": false
      }
    },
    "tombstones": {
      "maxItems": 500000,
      "type": "array",
      "items": {
        "type": "object",
        "properties": {
          "kind": {
            "type": "string",
            "enum": [
              "visit",
              "trip",
              "story"
            ]
          },
          "id": {
            "type": "string",
            "minLength": 1,
            "maxLength": 100
          },
          "deletedAt": {
            "type": "string",
            "format": "date-time",
            "pattern": "^(?:(?:\\d\\d[2468][048]|\\d\\d[13579][26]|\\d\\d0[48]|[02468][048]00|[13579][26]00)-02-29|\\d{4}-(?:(?:0[13578]|1[02])-(?:0[1-9]|[12]\\d|3[01])|(?:0[469]|11)-(?:0[1-9]|[12]\\d|30)|(?:02)-(?:0[1-9]|1\\d|2[0-8])))T(?:(?:[01]\\d|2[0-3]):[0-5]\\d(?::[0-5]\\d(?:\\.\\d+)?)?(?:Z|([+-](?:[01]\\d|2[0-3]):[0-5]\\d)))$"
          }
        },
        "required": [
          "kind",
          "id",
          "deletedAt"
        ],
        "additionalProperties": false
      }
    },
    "referenceSources": {
      "default": [],
      "maxItems": 10000,
      "type": "array",
      "items": {
        "type": "object",
        "properties": {
          "dataset": {
            "type": "string",
            "maxLength": 100
          },
          "license": {
            "type": "string",
            "maxLength": 100
          },
          "version": {
            "type": "string",
            "maxLength": 50
          },
          "url": {
            "type": "string",
            "maxLength": 300
          }
        },
        "required": [
          "dataset",
          "license",
          "version"
        ],
        "additionalProperties": false
      }
    }
  },
  "required": [
    "format",
    "schemaVersion",
    "exportedAt",
    "visits"
  ],
  "additionalProperties": false
}
