{"format":"postcards","schemaVersion":12,"exportedAt":"2026-09-01T10:00:00.000Z","visits":[{"visitId":"v-1","place":{"kind":"city","id":"2988507","name":"Paris","countryId":"FR"},"status":"visited","favorite":true,"date":"2019-04-12","note":null,"addedAt":"2026-09-01T10:00:00.000Z"},{"visitId":"v-2","place":{"kind":"city","id":"2996944","name":"Lyon","countryId":"FR"},"status":"visited","favorite":false,"date":"2019-04-15","note":null,"addedAt":"2026-09-01T10:00:00.000Z"},{"visitId":"v-3","place":{"kind":"city","id":"2995469","name":"Marseille","countryId":"FR"},"status":"visited","favorite":false,"date":"2019-04-18","note":null,"addedAt":"2026-09-01T10:00:00.000Z"},{"visitId":"v-4","place":{"kind":"city","id":"1850147","name":"Tokyo","countryId":"JP"},"status":"visited","favorite":false,"date":"2023-03-20","note":"Cherry blossoms in Ueno park.","photos":[{"src":"data:image/png;base64,iVBORw0KGgoAAAANSUhEUgAAABAAAAAKCAIAAAAy3EnLAAAAFElEQVR4nGM4UWFDEmIY1TA0NQAAsjftgWXbi3AAAAAASUVORK5CYII=","caption":"Ueno"}],"addedAt":"2026-09-01T10:00:00.000Z"},{"visitId":"v-5","place":{"kind":"city","id":"1857910","name":"Kyoto","countryId":"JP"},"status":"visited","favorite":false,"date":"2023-03-25","note":null,"addedAt":"2026-09-01T10:00:00.000Z"},{"visitId":"v-6","place":{"kind":"city","id":"1853909","name":"Osaka","countryId":"JP"},"status":"visited","favorite":false,"date":"2023-03-28","note":null,"addedAt":"2026-09-01T10:00:00.000Z"},{"visitId":"v-7","place":{"kind":"city","id":"1835848","name":"Seoul","countryId":"KR"},"status":"visited","favorite":false,"date":"2024-05-02","note":null,"addedAt":"2026-09-01T10:00:00.000Z"},{"visitId":"v-8","place":{"kind":"city","id":"1838524","name":"Busan","countryId":"KR"},"status":"visited","favorite":true,"date":"2024-05-06","note":null,"addedAt":"2026-09-01T10:00:00.000Z"},{"visitId":"v-9","place":{"kind":"city","id":"524901","name":"Moscow","countryId":"RU"},"status":"visited","favorite":false,"date":"2018-07-10","note":null,"addedAt":"2026-09-01T10:00:00.000Z"},{"visitId":"v-10","place":{"kind":"city","id":"498817","name":"Saint Petersburg","countryId":"RU"},"status":"visited","favorite":false,"date":"2018-07-14","note":null,"addedAt":"2026-09-01T10:00:00.000Z"},{"visitId":"v-11","place":{"kind":"city","id":"264371","name":"Athens","countryId":"GR"},"status":"visited","favorite":false,"date":"2022-08-01","note":null,"addedAt":"2026-09-01T10:00:00.000Z"},{"visitId":"v-12","place":{"kind":"city","id":"734077","name":"Thessaloníki","countryId":"GR"},"status":"visited","favorite":false,"date":"2022-08-05","note":null,"addedAt":"2026-09-01T10:00:00.000Z"},{"visitId":"v-13","place":{"kind":"city","id":"2950159","name":"Berlin","countryId":"DE"},"status":"visited","favorite":false,"date":"2017-06-03","note":null,"addedAt":"2026-09-01T10:00:00.000Z"},{"visitId":"v-14","place":{"kind":"city","id":"2867714","name":"Munich","countryId":"DE"},"status":"visited","favorite":false,"date":"2017-06-07","note":null,"addedAt":"2026-09-01T10:00:00.000Z"},{"visitId":"v-15","place":{"kind":"city","id":"3169070","name":"Rome","countryId":"IT"},"status":"visited","favorite":true,"date":"2021-09-10","note":null,"addedAt":"2026-09-01T10:00:00.000Z"},{"visitId":"v-16","place":{"kind":"city","id":"3176959","name":"Florence","countryId":"IT"},"status":"visited","favorite":false,"date":"2021-09-12","note":null,"addedAt":"2026-09-01T10:00:00.000Z"},{"visitId":"v-17","place":{"kind":"city","id":"3164603","name":"Venice","countryId":"IT"},"status":"visited","favorite":false,"date":"2021-09-15","note":null,"addedAt":"2026-09-01T10:00:00.000Z"},{"visitId":"v-18","place":{"kind":"city","id":"3128760","name":"Barcelona","countryId":"ES"},"status":"visited","favorite":false,"date":"2016-05-01","note":null,"addedAt":"2026-09-01T10:00:00.000Z"},{"visitId":"v-19","place":{"kind":"city","id":"3117735","name":"Madrid","countryId":"ES"},"status":"visited","favorite":false,"date":"2016-05-04","note":null,"addedAt":"2026-09-01T10:00:00.000Z"},{"visitId":"v-20","place":{"kind":"city","id":"2267057","name":"Lisbon","countryId":"PT"},"status":"visited","favorite":false,"date":"2020-02-02","note":null,"addedAt":"2026-09-01T10:00:00.000Z"},{"visitId":"v-21","place":{"kind":"city","id":"5128581","name":"New York City","countryId":"US"},"status":"visited","favorite":false,"date":"2015-10-10","note":null,"addedAt":"2026-09-01T10:00:00.000Z"},{"visitId":"v-22","place":{"kind":"city","id":"5391959","name":"San Francisco","countryId":"US"},"status":"visited","favorite":true,"date":"2015-10-15","note":null,"addedAt":"2026-09-01T10:00:00.000Z"},{"visitId":"v-23","place":{"kind":"city","id":"6077243","name":"Montréal","countryId":"CA"},"status":"visited","favorite":false,"date":"2014-08-20","note":null,"addedAt":"2026-09-01T10:00:00.000Z"},{"visitId":"v-24","place":{"kind":"city","id":"2542997","name":"Marrakesh","countryId":"MA"},"status":"visited","favorite":false,"date":"2025-01-05","note":null,"addedAt":"2026-09-01T10:00:00.000Z"},{"visitId":"v-25","place":{"kind":"city","id":"1609350","name":"Bangkok","countryId":"TH"},"status":"visited","favorite":false,"date":"2025-12-24","note":null,"addedAt":"2026-09-01T10:00:00.000Z"},{"visitId":"v-26","place":{"kind":"city","id":"1581130","name":"Hanoi","countryId":"VN"},"status":"visited","favorite":false,"date":"2025-12-28","note":null,"addedAt":"2026-09-01T10:00:00.000Z"},{"visitId":"v-27","place":{"kind":"airport","id":"CDG","name":"Charles de Gaulle International Airport","countryId":"FR"},"status":"visited","favorite":false,"date":null,"note":null,"addedAt":"2026-09-01T10:00:00.000Z"},{"visitId":"v-28","place":{"kind":"airport","id":"HND","name":"Tokyo Haneda International Airport","countryId":"JP"},"status":"visited","favorite":false,"date":null,"note":null,"addedAt":"2026-09-01T10:00:00.000Z"},{"visitId":"v-29","place":{"kind":"airport","id":"ICN","name":"Incheon International Airport","countryId":"KR"},"status":"visited","favorite":false,"date":null,"note":null,"addedAt":"2026-09-01T10:00:00.000Z"},{"visitId":"v-30","place":{"kind":"airport","id":"ATH","name":"Eleftherios Venizelos International Airport","countryId":"GR"},"status":"visited","favorite":false,"date":null,"note":null,"addedAt":"2026-09-01T10:00:00.000Z"},{"visitId":"v-31","place":{"kind":"heritage","id":"whs-acropolis-athens","name":"Acropolis, Athens","countryId":"GR"},"status":"visited","favorite":false,"date":null,"note":null,"addedAt":"2026-09-01T10:00:00.000Z"},{"visitId":"v-32","place":{"kind":"heritage","id":"whs-gyeongju-historic-areas","name":"Gyeongju Historic Areas","countryId":"KR"},"status":"visited","favorite":false,"date":null,"note":null,"addedAt":"2026-09-01T10:00:00.000Z"},{"visitId":"v-33","place":{"kind":"heritage","id":"whs-kremlin-and-red-square-moscow","name":"Kremlin and Red Square, Moscow","countryId":"RU"},"status":"visited","favorite":false,"date":null,"note":null,"addedAt":"2026-09-01T10:00:00.000Z"},{"visitId":"v-34","place":{"kind":"heritage","id":"whs-mont-saint-michel-and-its-bay","name":"Mont-Saint-Michel and its Bay","countryId":"FR"},"status":"visited","favorite":false,"date":null,"note":null,"addedAt":"2026-09-01T10:00:00.000Z"},{"visitId":"v-35","place":{"kind":"city","id":"360630","name":"Cairo","countryId":"EG"},"status":"wishlist","favorite":false,"date":null,"note":null,"addedAt":"2026-09-01T10:00:00.000Z"}],"trips":[{"tripId":"t-1","name":"Japan 2023","from":{"kind":"airport","id":"CDG","name":"Charles de Gaulle International Airport","countryId":"FR"},"to":{"kind":"city","id":"1857910","name":"Kyoto","countryId":"JP"},"stops":[{"kind":"airport","id":"CDG","name":"Charles de Gaulle International Airport","countryId":"FR"},{"kind":"airport","id":"HND","name":"Tokyo Haneda International Airport","countryId":"JP"},{"kind":"city","id":"1850147","name":"Tokyo","countryId":"JP"},{"kind":"city","id":"1853909","name":"Osaka","countryId":"JP"},{"kind":"city","id":"1857910","name":"Kyoto","countryId":"JP"}],"mode":"flight","legModes":["flight","train","train","train"],"date":"2023-03","carrier":"Air France","note":null,"addedAt":"2026-09-01T10:00:00.000Z"},{"tripId":"t-2","name":"Greece","from":{"kind":"city","id":"2988507","name":"Paris","countryId":"FR"},"to":{"kind":"city","id":"264371","name":"Athens","countryId":"GR"},"mode":"flight","date":"2022-08-01","carrier":null,"note":null,"addedAt":"2026-09-01T10:00:00.000Z"},{"tripId":"t-3","from":{"kind":"city","id":"1835848","name":"Seoul","countryId":"KR"},"to":{"kind":"city","id":"1838524","name":"Busan","countryId":"KR"},"mode":"train","date":"2024-05-05","carrier":"KTX","note":null,"addedAt":"2026-09-01T10:00:00.000Z"}],"stories":[{"storyId":"s-1","place":{"kind":"city","id":"1857910","name":"Kyoto","countryId":"JP"},"date":"2023-03-27","title":"Temples at dawn","text":"We woke at five to walk up to Kiyomizu-dera before the crowds.","folder":"Japan 2023","photos":[{"src":"data:image/png;base64,iVBORw0KGgoAAAANSUhEUgAAABAAAAAKCAIAAAAy3EnLAAAAFElEQVR4nGM4UWFDEmIY1TA0NQAAsjftgWXbi3AAAAAASUVORK5CYII=","caption":"Kiyomizu"},{"src":"data:image/png;base64,iVBORw0KGgoAAAANSUhEUgAAABAAAAAKCAIAAAAy3EnLAAAAFElEQVR4nGM4UWFDEmIY1TA0NQAAsjftgWXbi3AAAAAASUVORK5CYII=","caption":null}],"addedAt":"2026-09-01T10:00:00.000Z"},{"storyId":"s-2","place":{"kind":"city","id":"264371","name":"Athens","countryId":"GR"},"date":"2022-08-02","title":"Αθήνα by night","text":"Dinner under the Acropolis.","photos":[{"src":"data:image/png;base64,iVBORw0KGgoAAAANSUhEUgAAABAAAAAKCAIAAAAy3EnLAAAAFElEQVR4nGM4UWFDEmIY1TA0NQAAsjftgWXbi3AAAAAASUVORK5CYII=","caption":"Plaka"}],"addedAt":"2026-09-01T10:00:00.000Z"}],"referenceSources":[]}